ID,Title,Description,Acceptance,Test_Method,Tools,Dev_Status,Review1_Status,Regression_Status,Files,Dependencies,Notes
A1,同义实现扫描与清单,列出全仓 trace_id/X-Trace-Id 的“运行时/脚本/文档/archive”分组清单并锁定替换范围,输出清单并达成可执行范围共识,rg 检索结果 + 记录到 Notes,feedback:codebase-retrieval;rg;git,DONE,TODO,TODO,"e2e/anon_jwt_sse/**;scripts/dump_handover.py;docs/**;.env.example",无,"扫描结果：e2e/anon_jwt_sse/** + scripts/dump_handover.py + docs/runbooks/README.md + docs/api-contracts/** + .env.example（已全部收敛）；archive 保留旧术语"
A2,e2e/postman 收敛,将 e2e 脚本与 postman collection/env 统一改用 X-Request-Id 与 request_id 变量/断言,e2e/postman 中不再出现 X-Trace-Id/trace_id,rg 检索 + 关键脚本手跑(可选),rg;git,DONE,TODO,TODO,"e2e/anon_jwt_sse/**;e2e/anon_jwt_sse/postman/**",A1,"字段/头替换，不改业务逻辑"
A3,handover 脚本收敛,调整 dump_handover 以 request_id 为主查询键并兼容旧 trace_id 参数一段时间,脚本支持 --request-id 且输出字段为 request_id,脚本自检 + rg 无旧字段,python;rg;git,DONE,TODO,TODO,"scripts/dump_handover.py",A1,"保留 --trace-id 作为 deprecated alias"
A4,文档契约收敛,runbooks/api-contracts/jwt 改造文档及 .env.example 文案统一到 request_id + X-Request-Id,文档不再指导使用 X-Trace-Id,rg 检索 + 文档 review,rg;git,DONE,TODO,TODO,"docs/**;.env.example",A1,"archive 目录保留旧术语"
A5,Web 调用与示例收口,Web 侧 `/messages` 入口只通过 createMessage 并提供 promptMode/requestId 配置；示例页不再散落旧 SSE 解析,web/src 中无重复封装且示例可按新参数调用,web build/lint(可选) + 静态检查,rg;pnpm;git,DONE,TODO,TODO,"web/src/api/aiModelSuite.js;web/src/views/test/mock-user.vue",A1,"mock-user.vue 改为 fetch 解析 SSE，避免 EventSource header 限制"
